{"$schema":"https://json-schema.org/draft/2020-12/schema","type":"object","additionalProperties":false,"required":["schema_version","robot","links","joints"],"properties":{"schema_version":{"const":"rmdg_v1"},"robot":{"type":"object","additionalProperties":false,"required":["mechanism_class","base_link_id","end_effector_link_id","units"],"properties":{"mechanism_class":{"const":"serial_manipulator"},"base_link_id":{"type":"string","pattern":"^L[0-9]+$"},"end_effector_link_id":{"type":"string","pattern":"^L[0-9]+$"},"units":{"const":"mm"}}},"links":{"type":"array","minItems":1,"items":{"type":"object","additionalProperties":false,"required":["link_id","functional_role","parent_joint_id","child_joint_ids","coarse_geometry","interfaces","evidence_views"],"properties":{"link_id":{"type":"string","pattern":"^L[0-9]+$"},"functional_role":{"enum":["base","shoulder","upper_arm","forearm","wrist","end_effector_interface","intermediate_link","auxiliary_rigid_group","unknown"]},"parent_joint_id":{"type":["string","null"],"pattern":"^J[0-9]+$"},"child_joint_ids":{"type":"array","items":{"type":"string","pattern":"^J[0-9]+$"}},"coarse_geometry":{"type":"object","additionalProperties":false,"required":["shape_family","estimated_length_mm","estimated_width_mm","estimated_height_mm"],"properties":{"shape_family":{"enum":["cylindrical_housing","box_like_housing","elongated_housing","tapered_housing","compact_joint_housing","flange_like","mixed","unknown"]},"estimated_length_mm":{"type":"number","minimum":0},"estimated_width_mm":{"type":"number","minimum":0},"estimated_height_mm":{"type":"number","minimum":0}}},"interfaces":{"type":"object","additionalProperties":false,"required":["proximal","distal"],"properties":{"proximal":{"type":"string"},"distal":{"type":"string"}}},"evidence_views":{"type":"array","minItems":1,"items":{"enum":["front","rear","left","right","top","isometric"]}}}}},"joints":{"type":"array","items":{"type":"object","additionalProperties":false,"required":["joint_id","parent_link_id","child_link_id","joint_type","functional_role","axis_base","origin_base_mm","limit","evidence_views"],"properties":{"joint_id":{"type":"string","pattern":"^J[0-9]+$"},"parent_link_id":{"type":"string","pattern":"^L[0-9]+$"},"child_link_id":{"type":"string","pattern":"^L[0-9]+$"},"joint_type":{"enum":["revolute","continuous","prismatic","fixed","unknown"]},"functional_role":{"type":"string","minLength":1},"axis_base":{"type":"array","minItems":3,"maxItems":3,"items":{"type":"number"}},"origin_base_mm":{"type":"array","minItems":3,"maxItems":3,"items":{"type":"number"}},"limit":{"type":"object","additionalProperties":false,"required":["lower_rad","upper_rad"],"properties":{"lower_rad":{"type":["number","null"]},"upper_rad":{"type":["number","null"]}}},"evidence_views":{"type":"array","minItems":1,"items":{"enum":["front","rear","left","right","top","isometric"]}}}}}}}
