{"schema_version":"rmdg_v1","robot":{"mechanism_class":"serial_manipulator","base_link_id":"L0","end_effector_link_id":"L1","units":"mm"},"links":[{"link_id":"L0","functional_role":"base","parent_joint_id":null,"child_joint_ids":["J0"],"coarse_geometry":{"shape_family":"compact_joint_housing","estimated_length_mm":100,"estimated_width_mm":100,"estimated_height_mm":80},"interfaces":{"proximal":"base","distal":"rotary_interface"},"evidence_views":["front"]},{"link_id":"L1","functional_role":"end_effector_interface","parent_joint_id":"J0","child_joint_ids":[],"coarse_geometry":{"shape_family":"elongated_housing","estimated_length_mm":200,"estimated_width_mm":60,"estimated_height_mm":60},"interfaces":{"proximal":"rotary_interface","distal":"tool"},"evidence_views":["front","isometric"]}],"joints":[{"joint_id":"J0","parent_link_id":"L0","child_link_id":"L1","joint_type":"revolute","functional_role":"base_rotation","axis_base":[0,0,1],"origin_base_mm":[0,0,80],"limit":{"lower_rad":null,"upper_rad":null},"evidence_views":["front","isometric"]}]}
